{
  "by_component": {
    "(shared)": {
      "high": 16.0,
      "likely": 8.0,
      "low": 4.0
    },
    "billing-batch": {
      "high": 8.1,
      "likely": 4.05,
      "low": 2.0
    },
    "orders-web": {
      "high": 5.1,
      "likely": 3.05,
      "low": 1.5
    },
    "settlement-c": {
      "high": 3.1,
      "likely": 2.05,
      "low": 1.0
    },
    "shared-scripts-config": {
      "high": 16.0,
      "likely": 8.0,
      "low": 4.0
    }
  },
  "high": 48.3,
  "label": "estimate — weights from config",
  "likely": 25.15,
  "lines": [
    {
      "component": "(shared)",
      "count": 2,
      "high": 16.0,
      "item": "integration",
      "level": "each",
      "likely": 8.0,
      "low": 4.0
    },
    {
      "component": "billing-batch",
      "count": 1,
      "high": 8.0,
      "item": "integration",
      "level": "each",
      "likely": 4.0,
      "low": 2.0
    },
    {
      "component": "billing-batch",
      "count": 1,
      "high": 0.1,
      "item": "sql",
      "level": "auto",
      "likely": 0.05,
      "low": 0.0
    },
    {
      "component": "orders-web",
      "count": 1,
      "high": 2.0,
      "item": "screen",
      "level": "simple",
      "likely": 1.0,
      "low": 0.5
    },
    {
      "component": "orders-web",
      "count": 1,
      "high": 3.0,
      "item": "service",
      "level": "simple",
      "likely": 2.0,
      "low": 1.0
    },
    {
      "component": "orders-web",
      "count": 1,
      "high": 0.1,
      "item": "sql",
      "level": "auto",
      "likely": 0.05,
      "low": 0.0
    },
    {
      "component": "settlement-c",
      "count": 1,
      "high": 3.0,
      "item": "service",
      "level": "simple",
      "likely": 2.0,
      "low": 1.0
    },
    {
      "component": "settlement-c",
      "count": 1,
      "high": 0.1,
      "item": "sql",
      "level": "auto",
      "likely": 0.05,
      "low": 0.0
    },
    {
      "component": "shared-scripts-config",
      "count": 2,
      "high": 16.0,
      "item": "integration",
      "level": "each",
      "likely": 8.0,
      "low": 4.0
    }
  ],
  "low": 12.5,
  "unit": "person-days",
  "weights": {
    "batch_job": {
      "complex": [
        4,
        6,
        9
      ],
      "medium": [
        2,
        3,
        5
      ],
      "simple": [
        1,
        2,
        3
      ],
      "very_complex": [
        8,
        12,
        18
      ]
    },
    "integration": {
      "each": [
        2,
        4,
        8
      ]
    },
    "library": {
      "keep": [
        0,
        0,
        0
      ],
      "migrate-jakarta": [
        0.5,
        1,
        2
      ],
      "remove": [
        0.5,
        1,
        2
      ],
      "replace": [
        3,
        5,
        10
      ],
      "rewrite": [
        10,
        20,
        40
      ],
      "upgrade": [
        0.25,
        0.5,
        1
      ],
      "use-bom": [
        0,
        0.1,
        0.25
      ]
    },
    "screen": {
      "complex": [
        2,
        4,
        6
      ],
      "medium": [
        1,
        2,
        3
      ],
      "simple": [
        0.5,
        1,
        2
      ],
      "very_complex": [
        4,
        7,
        10
      ]
    },
    "service": {
      "complex": [
        5,
        8,
        12
      ],
      "medium": [
        2,
        4,
        6
      ],
      "simple": [
        1,
        2,
        3
      ],
      "very_complex": [
        10,
        15,
        25
      ]
    },
    "sql": {
      "auto": [
        0,
        0.05,
        0.1
      ],
      "manual": [
        1,
        2,
        3
      ],
      "review": [
        0.25,
        0.5,
        1
      ]
    },
    "stored_procedure": {
      "manual": [
        2,
        4,
        8
      ],
      "review": [
        1,
        2,
        4
      ]
    }
  }
}
