{
  "by_component": {
    "(shared)": {
      "high": 11.0,
      "likely": 6.0,
      "low": 3.0
    },
    "settlement": {
      "high": 63.3,
      "likely": 34.65,
      "low": 17.75
    }
  },
  "high": 74.3,
  "label": "estimate — weights from config",
  "likely": 40.65,
  "lines": [
    {
      "component": "(shared)",
      "count": 1,
      "high": 3.0,
      "item": "batch_job",
      "level": "simple",
      "likely": 2.0,
      "low": 1.0
    },
    {
      "component": "(shared)",
      "count": 1,
      "high": 8.0,
      "item": "integration",
      "level": "each",
      "likely": 4.0,
      "low": 2.0
    },
    {
      "component": "settlement",
      "count": 1,
      "high": 5.0,
      "item": "batch_job",
      "level": "medium",
      "likely": 3.0,
      "low": 2.0
    },
    {
      "component": "settlement",
      "count": 5,
      "high": 40.0,
      "item": "integration",
      "level": "each",
      "likely": 20.0,
      "low": 10.0
    },
    {
      "component": "settlement",
      "count": 2,
      "high": 12.0,
      "item": "service",
      "level": "medium",
      "likely": 8.0,
      "low": 4.0
    },
    {
      "component": "settlement",
      "count": 3,
      "high": 0.3,
      "item": "sql",
      "level": "auto",
      "likely": 0.15,
      "low": 0.0
    },
    {
      "component": "settlement",
      "count": 1,
      "high": 3.0,
      "item": "sql",
      "level": "manual",
      "likely": 2.0,
      "low": 1.0
    },
    {
      "component": "settlement",
      "count": 3,
      "high": 3.0,
      "item": "sql",
      "level": "review",
      "likely": 1.5,
      "low": 0.75
    }
  ],
  "low": 20.75,
  "unit": "person-days",
  "weights": {
    "batch_job": {
      "complex": [
        4,
        6,
        9
      ],
      "medium": [
        2,
        3,
        5
      ],
      "simple": [
        1,
        2,
        3
      ],
      "very_complex": [
        8,
        12,
        18
      ]
    },
    "integration": {
      "each": [
        2,
        4,
        8
      ]
    },
    "library": {
      "keep": [
        0,
        0,
        0
      ],
      "migrate-jakarta": [
        0.5,
        1,
        2
      ],
      "remove": [
        0.5,
        1,
        2
      ],
      "replace": [
        3,
        5,
        10
      ],
      "rewrite": [
        10,
        20,
        40
      ],
      "upgrade": [
        0.25,
        0.5,
        1
      ],
      "use-bom": [
        0,
        0.1,
        0.25
      ]
    },
    "screen": {
      "complex": [
        2,
        4,
        6
      ],
      "medium": [
        1,
        2,
        3
      ],
      "simple": [
        0.5,
        1,
        2
      ],
      "very_complex": [
        4,
        7,
        10
      ]
    },
    "service": {
      "complex": [
        5,
        8,
        12
      ],
      "medium": [
        2,
        4,
        6
      ],
      "simple": [
        1,
        2,
        3
      ],
      "very_complex": [
        10,
        15,
        25
      ]
    },
    "sql": {
      "auto": [
        0,
        0.05,
        0.1
      ],
      "manual": [
        1,
        2,
        3
      ],
      "review": [
        0.25,
        0.5,
        1
      ]
    },
    "stored_procedure": {
      "manual": [
        2,
        4,
        8
      ],
      "review": [
        1,
        2,
        4
      ]
    }
  }
}
