{
  "by_component": {
    "teller-desk": {
      "high": 43.0,
      "likely": 21.5,
      "low": 11.75
    }
  },
  "high": 43.0,
  "label": "estimate — weights from config",
  "likely": 21.5,
  "lines": [
    {
      "component": "teller-desk",
      "count": 2,
      "high": 16.0,
      "item": "integration",
      "level": "each",
      "likely": 8.0,
      "low": 4.0
    },
    {
      "component": "teller-desk",
      "count": 1,
      "high": 0.0,
      "item": "library",
      "level": "keep",
      "likely": 0.0,
      "low": 0.0
    },
    {
      "component": "teller-desk",
      "count": 2,
      "high": 20.0,
      "item": "library",
      "level": "replace",
      "likely": 10.0,
      "low": 6.0
    },
    {
      "component": "teller-desk",
      "count": 3,
      "high": 6.0,
      "item": "screen",
      "level": "simple",
      "likely": 3.0,
      "low": 1.5
    },
    {
      "component": "teller-desk",
      "count": 1,
      "high": 1.0,
      "item": "sql",
      "level": "review",
      "likely": 0.5,
      "low": 0.25
    }
  ],
  "low": 11.75,
  "unit": "person-days",
  "weights": {
    "batch_job": {
      "complex": [
        4,
        6,
        9
      ],
      "medium": [
        2,
        3,
        5
      ],
      "simple": [
        1,
        2,
        3
      ],
      "very_complex": [
        8,
        12,
        18
      ]
    },
    "integration": {
      "each": [
        2,
        4,
        8
      ]
    },
    "library": {
      "keep": [
        0,
        0,
        0
      ],
      "migrate-jakarta": [
        0.5,
        1,
        2
      ],
      "remove": [
        0.5,
        1,
        2
      ],
      "replace": [
        3,
        5,
        10
      ],
      "rewrite": [
        10,
        20,
        40
      ],
      "upgrade": [
        0.25,
        0.5,
        1
      ],
      "use-bom": [
        0,
        0.1,
        0.25
      ]
    },
    "screen": {
      "complex": [
        2,
        4,
        6
      ],
      "medium": [
        1,
        2,
        3
      ],
      "simple": [
        0.5,
        1,
        2
      ],
      "very_complex": [
        4,
        7,
        10
      ]
    },
    "service": {
      "complex": [
        5,
        8,
        12
      ],
      "medium": [
        2,
        4,
        6
      ],
      "simple": [
        1,
        2,
        3
      ],
      "very_complex": [
        10,
        15,
        25
      ]
    },
    "sql": {
      "auto": [
        0,
        0.05,
        0.1
      ],
      "manual": [
        1,
        2,
        3
      ],
      "review": [
        0.25,
        0.5,
        1
      ]
    },
    "stored_procedure": {
      "manual": [
        2,
        4,
        8
      ],
      "review": [
        1,
        2,
        4
      ]
    }
  }
}
