{
  "by_component": {
    "orders-ws": {
      "high": 50.5,
      "likely": 28.2,
      "low": 14.0
    },
    "quote-axis": {
      "high": 12.0,
      "likely": 8.0,
      "low": 4.0
    },
    "rate-feed": {
      "high": 19.0,
      "likely": 10.0,
      "low": 5.0
    }
  },
  "high": 81.5,
  "label": "estimate — weights from config",
  "likely": 46.2,
  "lines": [
    {
      "component": "orders-ws",
      "count": 4,
      "high": 32.0,
      "item": "integration",
      "level": "each",
      "likely": 16.0,
      "low": 8.0
    },
    {
      "component": "orders-ws",
      "count": 2,
      "high": 0.0,
      "item": "library",
      "level": "keep",
      "likely": 0.0,
      "low": 0.0
    },
    {
      "component": "orders-ws",
      "count": 2,
      "high": 0.5,
      "item": "library",
      "level": "use-bom",
      "likely": 0.2,
      "low": 0.0
    },
    {
      "component": "orders-ws",
      "count": 6,
      "high": 18.0,
      "item": "service",
      "level": "simple",
      "likely": 12.0,
      "low": 6.0
    },
    {
      "component": "quote-axis",
      "count": 4,
      "high": 12.0,
      "item": "service",
      "level": "simple",
      "likely": 8.0,
      "low": 4.0
    },
    {
      "component": "rate-feed",
      "count": 2,
      "high": 16.0,
      "item": "integration",
      "level": "each",
      "likely": 8.0,
      "low": 4.0
    },
    {
      "component": "rate-feed",
      "count": 1,
      "high": 3.0,
      "item": "service",
      "level": "simple",
      "likely": 2.0,
      "low": 1.0
    }
  ],
  "low": 23.0,
  "unit": "person-days",
  "weights": {
    "batch_job": {
      "complex": [
        4,
        6,
        9
      ],
      "medium": [
        2,
        3,
        5
      ],
      "simple": [
        1,
        2,
        3
      ],
      "very_complex": [
        8,
        12,
        18
      ]
    },
    "integration": {
      "each": [
        2,
        4,
        8
      ]
    },
    "library": {
      "keep": [
        0,
        0,
        0
      ],
      "migrate-jakarta": [
        0.5,
        1,
        2
      ],
      "remove": [
        0.5,
        1,
        2
      ],
      "replace": [
        3,
        5,
        10
      ],
      "rewrite": [
        10,
        20,
        40
      ],
      "upgrade": [
        0.25,
        0.5,
        1
      ],
      "use-bom": [
        0,
        0.1,
        0.25
      ]
    },
    "screen": {
      "complex": [
        2,
        4,
        6
      ],
      "medium": [
        1,
        2,
        3
      ],
      "simple": [
        0.5,
        1,
        2
      ],
      "very_complex": [
        4,
        7,
        10
      ]
    },
    "service": {
      "complex": [
        5,
        8,
        12
      ],
      "medium": [
        2,
        4,
        6
      ],
      "simple": [
        1,
        2,
        3
      ],
      "very_complex": [
        10,
        15,
        25
      ]
    },
    "sql": {
      "auto": [
        0,
        0.05,
        0.1
      ],
      "manual": [
        1,
        2,
        3
      ],
      "review": [
        0.25,
        0.5,
        1
      ]
    },
    "stored_procedure": {
      "manual": [
        2,
        4,
        8
      ],
      "review": [
        1,
        2,
        4
      ]
    }
  }
}
