{
  "by_component": {
    "(shared)": {
      "high": 0.0,
      "likely": 0.0,
      "low": 0.0
    },
    "billing-api": {
      "high": 12.4,
      "likely": 8.2,
      "low": 4.0
    },
    "deploy": {
      "high": 8.0,
      "likely": 4.0,
      "low": 2.0
    },
    "legacy-portal": {
      "high": 54.0,
      "likely": 27.0,
      "low": 14.0
    },
    "orders-api": {
      "high": 41.5,
      "likely": 24.75,
      "low": 12.25
    },
    "orders-web": {
      "high": 39.0,
      "likely": 19.5,
      "low": 9.75
    }
  },
  "high": 154.9,
  "label": "estimate — weights from config",
  "likely": 83.45,
  "lines": [
    {
      "component": "(shared)",
      "count": 1,
      "high": 0.0,
      "item": "library",
      "level": "keep",
      "likely": 0.0,
      "low": 0.0
    },
    {
      "component": "billing-api",
      "count": 1,
      "high": 3.0,
      "item": "batch_job",
      "level": "simple",
      "likely": 2.0,
      "low": 1.0
    },
    {
      "component": "billing-api",
      "count": 7,
      "high": 0.0,
      "item": "library",
      "level": "keep",
      "likely": 0.0,
      "low": 0.0
    },
    {
      "component": "billing-api",
      "count": 3,
      "high": 9.0,
      "item": "service",
      "level": "simple",
      "likely": 6.0,
      "low": 3.0
    },
    {
      "component": "billing-api",
      "count": 4,
      "high": 0.4,
      "item": "sql",
      "level": "auto",
      "likely": 0.2,
      "low": 0.0
    },
    {
      "component": "deploy",
      "count": 1,
      "high": 8.0,
      "item": "integration",
      "level": "each",
      "likely": 4.0,
      "low": 2.0
    },
    {
      "component": "legacy-portal",
      "count": 2,
      "high": 0.0,
      "item": "library",
      "level": "keep",
      "likely": 0.0,
      "low": 0.0
    },
    {
      "component": "legacy-portal",
      "count": 1,
      "high": 10.0,
      "item": "library",
      "level": "replace",
      "likely": 5.0,
      "low": 3.0
    },
    {
      "component": "legacy-portal",
      "count": 1,
      "high": 40.0,
      "item": "library",
      "level": "rewrite",
      "likely": 20.0,
      "low": 10.0
    },
    {
      "component": "legacy-portal",
      "count": 2,
      "high": 4.0,
      "item": "screen",
      "level": "simple",
      "likely": 2.0,
      "low": 1.0
    },
    {
      "component": "orders-api",
      "count": 1,
      "high": 3.0,
      "item": "batch_job",
      "level": "simple",
      "likely": 2.0,
      "low": 1.0
    },
    {
      "component": "orders-api",
      "count": 2,
      "high": 16.0,
      "item": "integration",
      "level": "each",
      "likely": 8.0,
      "low": 4.0
    },
    {
      "component": "orders-api",
      "count": 8,
      "high": 0.0,
      "item": "library",
      "level": "keep",
      "likely": 0.0,
      "low": 0.0
    },
    {
      "component": "orders-api",
      "count": 1,
      "high": 6.0,
      "item": "service",
      "level": "medium",
      "likely": 4.0,
      "low": 2.0
    },
    {
      "component": "orders-api",
      "count": 5,
      "high": 15.0,
      "item": "service",
      "level": "simple",
      "likely": 10.0,
      "low": 5.0
    },
    {
      "component": "orders-api",
      "count": 5,
      "high": 0.5,
      "item": "sql",
      "level": "auto",
      "likely": 0.25,
      "low": 0.0
    },
    {
      "component": "orders-api",
      "count": 1,
      "high": 1.0,
      "item": "sql",
      "level": "review",
      "likely": 0.5,
      "low": 0.25
    },
    {
      "component": "orders-web",
      "count": 4,
      "high": 32.0,
      "item": "integration",
      "level": "each",
      "likely": 16.0,
      "low": 8.0
    },
    {
      "component": "orders-web",
      "count": 9,
      "high": 0.0,
      "item": "library",
      "level": "keep",
      "likely": 0.0,
      "low": 0.0
    },
    {
      "component": "orders-web",
      "count": 1,
      "high": 1.0,
      "item": "library",
      "level": "upgrade",
      "likely": 0.5,
      "low": 0.25
    },
    {
      "component": "orders-web",
      "count": 3,
      "high": 6.0,
      "item": "screen",
      "level": "simple",
      "likely": 3.0,
      "low": 1.5
    }
  ],
  "low": 42.0,
  "unit": "person-days",
  "weights": {
    "batch_job": {
      "complex": [
        4,
        6,
        9
      ],
      "medium": [
        2,
        3,
        5
      ],
      "simple": [
        1,
        2,
        3
      ],
      "very_complex": [
        8,
        12,
        18
      ]
    },
    "integration": {
      "each": [
        2,
        4,
        8
      ]
    },
    "library": {
      "keep": [
        0,
        0,
        0
      ],
      "migrate-jakarta": [
        0.5,
        1,
        2
      ],
      "remove": [
        0.5,
        1,
        2
      ],
      "replace": [
        3,
        5,
        10
      ],
      "rewrite": [
        10,
        20,
        40
      ],
      "upgrade": [
        0.25,
        0.5,
        1
      ],
      "use-bom": [
        0,
        0.1,
        0.25
      ]
    },
    "screen": {
      "complex": [
        2,
        4,
        6
      ],
      "medium": [
        1,
        2,
        3
      ],
      "simple": [
        0.5,
        1,
        2
      ],
      "very_complex": [
        4,
        7,
        10
      ]
    },
    "service": {
      "complex": [
        5,
        8,
        12
      ],
      "medium": [
        2,
        4,
        6
      ],
      "simple": [
        1,
        2,
        3
      ],
      "very_complex": [
        10,
        15,
        25
      ]
    },
    "sql": {
      "auto": [
        0,
        0.05,
        0.1
      ],
      "manual": [
        1,
        2,
        3
      ],
      "review": [
        0.25,
        0.5,
        1
      ]
    },
    "stored_procedure": {
      "manual": [
        2,
        4,
        8
      ],
      "review": [
        1,
        2,
        4
      ]
    }
  }
}
